<?xml version="1.0" encoding="UTF-8"?>
<CardsDeck Type="Chance" xmlns:xsi="http://www.w3.org/2001/XMLSchema-instance" xsi:noNamespaceSchemaLocation="MonopolySchema2.xsd">
	<BonusCard ID="1" Type="Money" Bank="true" Amount="20">
		<Message>You won the sehug contest of Rosh-Hayin get 20 shekels from the Bank</Message>
	</BonusCard>
	<BonusCard ID="2" Type="Money" Bank="false" Amount="100">
		<Message>For your marriage get 100 shekels from each player</Message>
	</BonusCard>
	<BonusCard ID="3" Type="Money" Bank="true" Amount="200">
		<Message>You won the European Dance Dance Revolution contest get 200 shekels from the Bank to buy your pride back</Message>
	</BonusCard>
	<BonusCard ID="4" Type="Money" Bank="false" Amount="0">
		<Message>You wrote an amazing Monoply game in Java, get tons of respect from all the other players!</Message>
	</BonusCard>
	<BonusCard ID="5" Type="Money" Bank="false" Amount="50">
		<Message>Sing a Britney Spears song and get 50 shekels from each player</Message>
	</BonusCard>
	<BonusCard ID="6" Type="Jail Pass">
		<Message>Keep this out of jail pass, it might come in handy!</Message>
	</BonusCard>
	<BonusCard ID="7" Type="MoveTo" MoveTo="Chance" GetGoCash="true">
		<Message>Feeling lucky? Move to the next 'Chance' cell and draw another card!</Message>
	</BonusCard>
	<BonusCard ID="8" Type="MoveTo" MoveTo="Go" GetGoCash="true">
		<Message>Lucky You. Move To GO square</Message>
	</BonusCard>
</CardsDeck>

